{
  "bundle": {
    "name": "example"
  },
  "edges": [
    {
      "id": "e1",
      "label": "see also",
      "source": "concepts/hello",
      "target": "concepts/world"
    }
  ],
  "nav": {
    "body": "# Index\n\n- [Hello](concepts/hello.md)\n",
    "children": [
      {
        "id": "concepts/hello",
        "kind": "concept",
        "label": "Hello"
      }
    ],
    "id": "",
    "kind": "dir",
    "label": "Root"
  },
  "nodes": [
    {
      "degree": 0,
      "description": "A sample concept",
      "id": "concepts/hello",
      "in": 0,
      "out": 0,
      "path": "concepts/hello.md",
      "rank": 1,
      "slug": "h",
      "tags": ["sample"],
      "title": "Hello",
      "type": "Reference",
      "weight": 1
    }
  ],
  "timestamp": "2026-07-10T05:00:00Z",
  "version": "0.1"
}
